{
  "$schema": "https://json-schema.org/draft/2020-12/schema",
  "title": "PCDeal Master Product Record",
  "type": "object",
  "required": [
    "id",
    "category",
    "name",
    "normalized_name",
    "sources"
  ],
  "properties": {
    "id": {
      "type": "string"
    },
    "category": {
      "type": "string"
    },
    "name": {
      "type": "string"
    },
    "normalized_name": {
      "type": "string"
    },
    "manufacturer": {
      "type": "string"
    },
    "brand": {
      "type": "string"
    },
    "series": {
      "type": "string"
    },
    "model": {
      "type": "string"
    },
    "variant": {
      "type": "string"
    },
    "aliases": {
      "type": "array",
      "items": {
        "type": "string"
      }
    },
    "identifiers": {
      "type": "object",
      "additionalProperties": {
        "type": [
          "string",
          "number",
          "null"
        ]
      }
    },
    "specs": {
      "type": "object",
      "additionalProperties": true
    },
    "sources": {
      "type": "array",
      "items": {
        "type": "object"
      }
    },
    "confidence": {
      "type": "number",
      "minimum": 0,
      "maximum": 100
    },
    "first_seen": {
      "type": "string"
    },
    "last_verified": {
      "type": "string"
    }
  }
}