[{"id":"pcd_073d5520b8a581d12760","category":"sfx","name":"GameMax GS","normalized_name":"gamemax gs","manufacturer":"","brand":"","series":"","model":"","variant":"Silver","aliases":[],"identifiers":{},"specs":{"efficiency":"bronze","wattage":300,"modular":false,"color":"Silver"},"sources":[{"source":"docyx/pc-part-dataset","source_path":"json/power-supply.json","url":null,"imported_at":"2026-10-12T16:50:12Z"},{"source":"docyx/pc-part-dataset","source_path":"jsonl/power-supply.jsonl","url":null,"imported_at":"2026-10-12T16:50:12Z"}],"confidence":63,"first_seen":"2026-10-12T16:50:12Z","last_verified":"2026-10-12T16:50:12Z"}]