[{"id":"pcd_cf3c9fea8f3e113909a2","category":"headphones","name":"ROCCAT","normalized_name":"roccat","manufacturer":"ROCCAT","brand":"ROCCAT","series":"","model":"","variant":"","aliases":[],"identifiers":{},"specs":{"opendb_id":"217525e1-479b-4752-9864-02e1e461c294","ear_pad_material":[],"connection_types":[],"features":[],"use_cases":[],"platforms":[],"lighting":[],"identifiers":{"version":1}},"sources":[{"source":"BuildCores OpenDB","source_path":"Headphones/217525e1-479b-4752-9864-02e1e461c294.json","url":null,"imported_at":"2026-10-26T14:25:00Z"},{"source":"BuildCores OpenDB","source_path":"Headphones/9933af81-16be-4517-9fd5-dc9af3fbcdde.json","url":null,"imported_at":"2026-10-26T14:25:00Z"},{"source":"BuildCores OpenDB","source_path":"Headphones/18fb0fcf-0bf8-4ff8-af80-4c00d8ab7ae3.json","url":null,"imported_at":"2026-10-26T14:25:00Z"},{"source":"BuildCores OpenDB","source_path":"Headphones/78be42fb-83af-40bd-9327-7487adc58df4.json","url":null,"imported_at":"2026-10-26T14:25:00Z"},{"source":"BuildCores OpenDB","source_path":"Headphones/ecfad395-8e8a-44e0-aa05-2a2426090a34.json","url":null,"imported_at":"2026-10-26T14:25:00Z"},{"source":"BuildCores OpenDB","source_path":"Headphones/245fd7ac-570a-4c65-bb7d-8a6634fc605e.json","url":null,"imported_at":"2026-10-26T14:25:00Z"},{"source":"BuildCores OpenDB","source_path":"Headphones/f010b44e-5c01-496f-8694-8724ad030ec8.json","url":null,"imported_at":"2026-10-26T14:25:00Z"},{"source":"BuildCores OpenDB","source_path":"Headphones/c664ead2-cb7e-4c59-9df9-1dd4e132d5b9.json","url":null,"imported_at":"2026-10-26T14:25:00Z"},{"source":"BuildCores OpenDB","source_path":"Headphones/c45b124d-90b1-4e62-a7dd-4748caec74b6.json","url":null,"imported_at":"2026-10-26T14:25:00Z"},{"source":"BuildCores OpenDB","source_path":"Headphones/540b2658-48d1-46bb-98c5-7997fee3fcea.json","url":null,"imported_at":"2026-10-26T14:25:00Z"},{"source":"BuildCores OpenDB","source_path":"Headphones/79cea7bb-5f6a-43b1-ade2-84c03941a471.json","url":null,"imported_at":"2026-10-26T14:25:00Z"},{"source":"BuildCores OpenDB","source_path":"Headphones/839aa7a8-41e2-4512-9efc-ef19b03adf71.json","url":null,"imported_at":"2026-10-26T14:25:00Z"},{"source":"BuildCores OpenDB","source_path":"Headphones/c62dcb99-63e7-4985-a6d6-dd29d3017ab2.json","url":null,"imported_at":"2026-10-26T14:25:00Z"},{"source":"BuildCores OpenDB","source_path":"Headphones/0114b878-6f9e-49d7-8eaa-b56c780dac99.json","url":null,"imported_at":"2026-10-26T14:25:00Z"},{"source":"BuildCores OpenDB","source_path":"Headphones/9a32bc82-09b4-4cca-80c7-63c6b80d7129.json","url":null,"imported_at":"2026-10-26T14:25:00Z"},{"source":"BuildCores OpenDB","source_path":"Headphones/ad0c2e2c-1320-4621-8be8-52c2fc9e51c9.json","url":null,"imported_at":"2026-10-26T14:25:00Z"},{"source":"BuildCores OpenDB","source_path":"Headphones/a552c187-5e19-4078-b4ff-3242ff11566f.json","url":null,"imported_at":"2026-10-26T14:25:00Z"},{"source":"BuildCores OpenDB","source_path":"Headphones/6088fa76-6e4c-4a00-b070-1559c2145e84.json","url":null,"imported_at":"2026-10-26T14:25:00Z"},{"source":"BuildCores OpenDB","source_path":"Headphones/60aae88a-92be-4c6a-b322-02946fd4b23c.json","url":null,"imported_at":"2026-10-26T14:25:00Z"},{"source":"BuildCores OpenDB","source_path":"Headphones/7ad7d5b5-29d5-49a3-b3fc-fc7528ea0dfe.json","url":null,"imported_at":"2026-10-26T14:25:00Z"},{"source":"BuildCores OpenDB","source_path":"Headphones/4e58a8ce-0640-45a6-a5f4-442bfc2d0686.json","url":null,"imported_at":"2026-10-26T14:25:00Z"},{"source":"BuildCores OpenDB","source_path":"Headphones/7514e869-5956-4e10-901f-f1219fbfe85e.json","url":null,"imported_at":"2026-10-26T14:25:00Z"},{"source":"BuildCores OpenDB","source_path":"Headphones/9b14644a-6ce1-485e-b4e6-523c14069438.json","url":null,"imported_at":"2026-10-26T14:25:00Z"}],"confidence":99,"first_seen":"2026-10-26T14:25:00Z","last_verified":"2026-10-26T14:25:00Z"}]