[{"id":"pcd_5a1b24f68a3c509f9724","category":"microatx-mid-tower","name":"Jonsbo MOD-3 Mini","normalized_name":"jonsbo mod-3 mini","manufacturer":"","brand":"","series":"","model":"","variant":"Gray","aliases":[],"identifiers":{},"specs":{"color":"Gray","psu":null,"side_panel":"Tempered Glass","external_volume":76.4,"internal_35_bays":1},"sources":[{"source":"docyx/pc-part-dataset","source_path":"json/case.json","url":null,"imported_at":"2026-10-19T14:46:25Z"},{"source":"docyx/pc-part-dataset","source_path":"jsonl/case.jsonl","url":null,"imported_at":"2026-10-19T14:46:25Z"}],"confidence":71,"first_seen":"2026-10-19T14:46:25Z","last_verified":"2026-10-19T14:46:25Z"}]