[{"id":"pcd_8014d9330e1f1cb723ed","category":"memory","name":"ADATA XPG LANCER BLADE 6000 CL34","normalized_name":"adata xpg lancer blade 6000 cl34","manufacturer":"ADATA","brand":"ADATA","series":"XPG LANCER BLADE","model":"","variant":"6000 CL34","aliases":["XPG LANCER BLADE","ADATA","ADATA XPG LANCER BLADE"],"identifiers":{},"specs":{"opendb_id":"c54222e4-6d9a-4e22-8146-4153238449cf","speed":6000,"ram_type":"DDR5","profile_support":["XMP","EXPO"],"form_factor":"288-pin DIMM","modules":{"quantity":2,"capacity_gb":16},"capacity":32,"color":["BLACK"],"lighting":["None"],"cas_latency":34,"voltage":null,"ecc":"Non-ECC","registered":"Unbuffered","heat_spreader":true,"rgb":false,"identifiers":{"version":1}},"sources":[{"source":"BuildCores OpenDB","source_path":"RAM/c54222e4-6d9a-4e22-8146-4153238449cf.json","url":null,"imported_at":"2026-10-19T14:46:25Z"}],"confidence":55,"first_seen":"2026-10-19T14:46:25Z","last_verified":"2026-10-19T14:46:25Z"},{"id":"pcd_cdc59fceaf20e2484f3b","category":"memory","name":"Innodisk OEM DDR5 ECC UDIMM","normalized_name":"innodisk oem ddr5 ecc udimm","manufacturer":"Innodisk","brand":"Innodisk","series":"OEM DDR5 ECC UDIMM","model":"","variant":"","aliases":["OEM DDR5 ECC UDIMM","Innodisk"],"identifiers":{},"specs":{"opendb_id":"2dd2415a-d0d2-42e0-9d7a-d062ca23025c","speed":5600,"ram_type":"DDR5","profile_support":["EXPO"],"form_factor":"288-pin DIMM","modules":{"quantity":1,"capacity_gb":16},"capacity":16,"color":["BLACK"],"lighting":[],"cas_latency":36,"voltage":1.1,"ecc":"Non-ECC","registered":"Unbuffered","identifiers":{"version":1}},"sources":[{"source":"BuildCores OpenDB","source_path":"RAM/2dd2415a-d0d2-42e0-9d7a-d062ca23025c.json","url":null,"imported_at":"2026-10-19T14:46:25Z"},{"source":"BuildCores OpenDB","source_path":"RAM/ad631af5-eb35-4fec-9ac1-f82210c12192.json","url":null,"imported_at":"2026-10-19T14:46:25Z"},{"source":"BuildCores OpenDB","source_path":"RAM/61ba15e8-df6f-4bb4-85c7-f681ec264705.json","url":null,"imported_at":"2026-10-19T14:46:25Z"},{"source":"BuildCores OpenDB","source_path":"RAM/7f868491-6d46-4c59-9d94-4df043adc39b.json","url":null,"imported_at":"2026-10-19T14:46:25Z"},{"source":"BuildCores OpenDB","source_path":"RAM/15fe52ae-5741-48f8-9b8a-87010e4b7b05.json","url":null,"imported_at":"2026-10-19T14:46:25Z"}],"confidence":87,"first_seen":"2026-10-19T14:46:25Z","last_verified":"2026-10-19T14:46:25Z"},{"id":"pcd_1e89ed6d640515eb20db","category":"memory","name":"Samsung OEM DDR5 ECC UDIMM","normalized_name":"samsung oem ddr5 ecc udimm","manufacturer":"Samsung","brand":"Samsung","series":"OEM DDR5 ECC UDIMM","model":"","variant":"","aliases":["OEM DDR5 ECC UDIMM","Samsung"],"identifiers":{},"specs":{"opendb_id":"455e454c-579a-4dc8-880e-8a51c6046d07","speed":5600,"ram_type":"DDR5","profile_support":["EXPO"],"form_factor":"288-pin DIMM","modules":{"quantity":1,"capacity_gb":32},"capacity":32,"color":["BLACK"],"lighting":[],"cas_latency":36,"voltage":1.1,"ecc":"Non-ECC","registered":"Unbuffered","identifiers":{"version":1}},"sources":[{"source":"BuildCores OpenDB","source_path":"RAM/455e454c-579a-4dc8-880e-8a51c6046d07.json","url":null,"imported_at":"2026-10-19T14:46:25Z"}],"confidence":55,"first_seen":"2026-10-19T14:46:25Z","last_verified":"2026-10-19T14:46:25Z"},{"id":"pcd_51cdf0cd775e8cd1d0ee","category":"memory","name":"VisionTek 900390 1600 CL8","normalized_name":"visiontek 900390 1600 cl8","manufacturer":"VisionTek","brand":"VisionTek","series":"900390","model":"","variant":"1600 CL8","aliases":["900390","VisionTek","VisionTek 900390"],"identifiers":{},"specs":{"opendb_id":"ac41ea8c-0da3-4cdd-94d7-2c289b34af92","speed":1600,"ram_type":"DDR3","profile_support":[],"form_factor":"240-pin DIMM","modules":{"quantity":1,"capacity_gb":2},"capacity":2,"color":["BLACK"],"lighting":[],"cas_latency":8,"voltage":null,"ecc":"Non-ECC","registered":"Unbuffered","heat_spreader":true,"rgb":false,"identifiers":{"version":1}},"sources":[{"source":"BuildCores OpenDB","source_path":"RAM/ac41ea8c-0da3-4cdd-94d7-2c289b34af92.json","url":null,"imported_at":"2026-10-19T14:46:25Z"}],"confidence":55,"first_seen":"2026-10-19T14:46:25Z","last_verified":"2026-10-19T14:46:25Z"}]