[{"id":"pcd_c67acc2c3d72886d63dd","category":"mouse","name":"Arbiter Studio Akitsu Medium","normalized_name":"arbiter studio akitsu medium","manufacturer":"Arbiter Studio","brand":"Arbiter Studio","series":"Akitsu","model":"","variant":"Medium","aliases":["Akitsu","Arbiter Studio","Arbiter Studio Akitsu"],"identifiers":{},"specs":{"opendb_id":"a66c2dc9-b614-4216-9282-e55e2fa3a97e","connectivity":["Wireless 2.4GHz"],"lighting":[],"grip_types":[],"identifiers":{"version":1}},"sources":[{"source":"BuildCores OpenDB","source_path":"Mouse/a66c2dc9-b614-4216-9282-e55e2fa3a97e.json","url":null,"imported_at":"2026-10-19T14:46:25Z"}],"confidence":55,"first_seen":"2026-10-19T14:46:25Z","last_verified":"2026-10-19T14:46:25Z"},{"id":"pcd_dcfeee671abe023997be","category":"mouse","name":"Dareu EM901","normalized_name":"dareu em901","manufacturer":"Dareu","brand":"Dareu","series":"EM901","model":"","variant":"","aliases":["EM901","Dareu"],"identifiers":{},"specs":{"opendb_id":"7c42ee8f-2ec1-4a14-8835-79cbadc1385a","connectivity":["Wireless 2.4GHz"],"lighting":[],"grip_types":[],"identifiers":{"version":1}},"sources":[{"source":"BuildCores OpenDB","source_path":"Mouse/7c42ee8f-2ec1-4a14-8835-79cbadc1385a.json","url":null,"imported_at":"2026-10-19T14:46:25Z"}],"confidence":55,"first_seen":"2026-10-19T14:46:25Z","last_verified":"2026-10-19T14:46:25Z"},{"id":"pcd_b68f92b5ff454afa6ef1","category":"mouse","name":"Microsoft Arc Wireless Sage Green","normalized_name":"microsoft arc wireless sage green","manufacturer":"Microsoft","brand":"Microsoft","series":"Arc Wireless","model":"","variant":"Sage Green","aliases":["Arc Wireless","Microsoft","Microsoft Arc Wireless"],"identifiers":{},"specs":{"opendb_id":"285e2d93-8721-4597-99de-dcebe5f18412","connectivity":["Bluetooth"],"rgb":false,"lighting":[],"grip_types":[],"general_product_information":{"manufacturer_url":"https://www.microsoft.com/en-us/d/surface-arc-mouse/8p5sv2rx3rn5"},"identifiers":{"version":1}},"sources":[{"source":"BuildCores OpenDB","source_path":"Mouse/285e2d93-8721-4597-99de-dcebe5f18412.json","url":null,"imported_at":"2026-10-19T14:46:25Z"}],"confidence":55,"first_seen":"2026-10-19T14:46:25Z","last_verified":"2026-10-19T14:46:25Z"},{"id":"pcd_1248d6c349330a6645be","category":"mouse","name":"Qumax","normalized_name":"qumax","manufacturer":"Qumax","brand":"Qumax","series":"","model":"","variant":"","aliases":[],"identifiers":{},"specs":{"opendb_id":"a13d62ef-b4e1-4537-94b6-2c614385960f","connectivity":[],"lighting":[],"identifiers":{"version":1},"grip_types":[]},"sources":[{"source":"BuildCores OpenDB","source_path":"Mouse/a13d62ef-b4e1-4537-94b6-2c614385960f.json","url":null,"imported_at":"2026-10-19T14:46:25Z"},{"source":"BuildCores OpenDB","source_path":"Mouse/66cc5e51-fb98-40c2-9487-8192ea8b902b.json","url":null,"imported_at":"2026-10-19T14:46:25Z"}],"confidence":63,"first_seen":"2026-10-19T14:46:25Z","last_verified":"2026-10-19T14:46:25Z"},{"id":"pcd_c5367a0ae25e8e776f8a","category":"mouse","name":"Rii","normalized_name":"rii","manufacturer":"Rii","brand":"Rii","series":"","model":"","variant":"","aliases":[],"identifiers":{},"specs":{"opendb_id":"5fac6cae-f144-4f72-beeb-fa5ddc01ca28","connectivity":[],"lighting":[],"grip_types":[],"identifiers":{"version":1}},"sources":[{"source":"BuildCores OpenDB","source_path":"Mouse/5fac6cae-f144-4f72-beeb-fa5ddc01ca28.json","url":null,"imported_at":"2026-10-19T14:46:25Z"},{"source":"BuildCores OpenDB","source_path":"Mouse/96561bad-bbb8-494a-a4ec-bb4328bff2dc.json","url":null,"imported_at":"2026-10-19T14:46:25Z"}],"confidence":63,"first_seen":"2026-10-19T14:46:25Z","last_verified":"2026-10-19T14:46:25Z"},{"id":"pcd_a811d10d424a08eb9a46","category":"mouse","name":"Turtle Beach Kone II Air","normalized_name":"turtle beach kone ii air","manufacturer":"Turtle Beach","brand":"Turtle Beach","series":"Kone II","model":"","variant":"Air","aliases":["Kone II","Turtle Beach","Turtle Beach Kone II"],"identifiers":{},"specs":{"opendb_id":"da07eb58-65e8-4975-919a-ec1bdea318f0","connectivity":["Wireless 2.4GHz"],"lighting":[],"grip_types":[],"identifiers":{"version":1}},"sources":[{"source":"BuildCores OpenDB","source_path":"Mouse/da07eb58-65e8-4975-919a-ec1bdea318f0.json","url":null,"imported_at":"2026-10-19T14:46:25Z"}],"confidence":55,"first_seen":"2026-10-19T14:46:25Z","last_verified":"2026-10-19T14:46:25Z"}]