[{"id":"pcd_be41e0bd7b25419f2b19","category":"sfx","name":"SeaSonic FOCUS SGX","normalized_name":"seasonic focus sgx","manufacturer":"","brand":"","series":"","model":"","variant":"Black","aliases":[],"identifiers":{},"specs":{"efficiency":"gold","wattage":650,"modular":"Full","color":"Black"},"sources":[{"source":"docyx/pc-part-dataset","source_path":"json/power-supply.json","url":null,"imported_at":"2026-10-19T14:46:25Z"},{"source":"docyx/pc-part-dataset","source_path":"jsonl/power-supply.jsonl","url":null,"imported_at":"2026-10-19T14:46:25Z"}],"confidence":79,"first_seen":"2026-10-19T14:46:25Z","last_verified":"2026-10-19T14:46:25Z"}]