[{"id":"pcd_55013d9c92e7c373eb9c","category":"mini-itx-desktop","name":"In Win Chopin MAX","normalized_name":"in win chopin max","manufacturer":"","brand":"","series":"","model":"","variant":"Gray","aliases":[],"identifiers":{},"specs":{"color":"Gray","psu":200,"side_panel":"Mesh","external_volume":4.4,"internal_35_bays":0},"sources":[{"source":"docyx/pc-part-dataset","source_path":"json/case.json","url":null,"imported_at":"2026-10-26T14:25:00Z"},{"source":"docyx/pc-part-dataset","source_path":"jsonl/case.jsonl","url":null,"imported_at":"2026-10-26T14:25:00Z"}],"confidence":79,"first_seen":"2026-10-26T14:25:00Z","last_verified":"2026-10-26T14:25:00Z"},{"id":"pcd_d206152a57dc3c1e38c9","category":"mini-itx-desktop","name":"MagniumGear Neo Mini V2","normalized_name":"magniumgear neo mini v2","manufacturer":"","brand":"","series":"","model":"","variant":"Black","aliases":[],"identifiers":{},"specs":{"color":"Black","psu":null,"side_panel":"Tempered Glass","external_volume":null,"internal_35_bays":1},"sources":[{"source":"docyx/pc-part-dataset","source_path":"json/case.json","url":null,"imported_at":"2026-10-26T14:25:00Z"},{"source":"docyx/pc-part-dataset","source_path":"jsonl/case.jsonl","url":null,"imported_at":"2026-10-26T14:25:00Z"}],"confidence":71,"first_seen":"2026-10-26T14:25:00Z","last_verified":"2026-10-26T14:25:00Z"}]