[{"id":"pcd_955de4338bdc069fec72","category":"gpu","name":"GeForce RTX 5060 Infinity 2 OC","normalized_name":"geforce rtx 5060 infinity 2 oc","manufacturer":"","brand":"","series":"GeForce RTX 5060","model":"","variant":"Infinity 2 OC","aliases":["GeForce RTX 5060"],"identifiers":{},"specs":{"opendb_id":"966d7f22-0d01-41ac-b685-d50d1d9072de","chipset_manufacturer":"NVIDIA","chipset":"GeForce RTX 5060","core_count":3840,"core_base_clock":2280,"core_boost_clock":2512,"memory":8,"memory_type":"GDDR7","effective_memory_clock":1750,"memory_bus":128,"tdp":145,"interface":"PCIe 5.0 x8","frame_sync":"G-Sync","color":["BLACK"],"lighting":[],"length":262.1,"case_expansion_slot_width":2,"total_slot_width":2,"cooling":"2 Fans","power_connectors":{"pcie_8_pin":2},"video_outputs":{"hdmi_2_2":0,"hdmi_2_1":1,"hdmi_2_0":0,"displayport_2_1":0,"displayport_2_1a":0,"displayport_1_4a":0,"displayport_2_1_b":3,"dvi_d":0,"vga":0},"general_product_information":{"manufacturer_url":"https://www.palit.com/palit/vgapro.php?id=5755&lang=en&pn=NE75060V19P1-GB2063L&tab=sp"},"identifiers":{"version":1}},"sources":[{"source":"BuildCores OpenDB","source_path":"GPU/966d7f22-0d01-41ac-b685-d50d1d9072de.json","url":null,"imported_at":"2026-10-19T14:46:25Z"}],"confidence":55,"first_seen":"2026-10-19T14:46:25Z","last_verified":"2026-10-19T14:46:25Z"},{"id":"pcd_ed1ec508629a8065fb1f","category":"gpu","name":"MSI VENTUS 2X E","normalized_name":"msi ventus 2x e","manufacturer":"MSI","brand":"MSI","series":"VENTUS","model":"","variant":"2X E","aliases":["VENTUS","MSI","MSI VENTUS"],"identifiers":{},"specs":{"opendb_id":"9b301b70-9cec-40ff-8ed7-e6a1594b30f7","chipset_manufacturer":"NVIDIA","chipset":"GeForce RTX 3050 6 GB","core_count":2304,"core_base_clock":1042,"core_boost_clock":1470,"memory":6,"memory_type":"GDDR6","effective_memory_clock":1750,"memory_bus":96,"tdp":70,"interface":"PCIe 4.0 x8","color":["BLACK"],"lighting":["None"],"length":189,"total_slot_width":2,"cooling":"2 Fans","power_connectors":{"pcie_6_pin":0,"pcie_8_pin":0,"pcie_12VHPWR":0,"pcie_12V_2x6":0},"video_outputs":{"hdmi_2_2":0,"hdmi_2_1":2,"hdmi_2_1a":0,"hdmi_2_1b":0,"hdmi_2_0":0,"hdmi_2_0a":0,"hdmi_2_0b":0,"displayport_2_1":0,"displayport_2_1a":0,"displayport_1_4a":1,"displayport_2_1_b":0,"usb_c":0,"dvi_d":0,"vga":0},"identifiers":{"version":1},"frame_sync":"G-Sync","case_expansion_slot_width":2,"radiator_size":0,"fan_size":0,"fan_quantity":0,"general_product_information":{"manufacturer_url":"https://www.msi.com/Graphics-Card/GeForce-RTX-3050-VENTUS-2X-E-6G/Specification"}},"sources":[{"source":"BuildCores OpenDB","source_path":"GPU/9b301b70-9cec-40ff-8ed7-e6a1594b30f7.json","url":null,"imported_at":"2026-10-19T14:46:25Z"},{"source":"BuildCores OpenDB","source_path":"GPU/a24eec21-f808-4bb9-8640-2a7f49b2f308.json","url":null,"imported_at":"2026-10-19T14:46:25Z"}],"confidence":63,"first_seen":"2026-10-19T14:46:25Z","last_verified":"2026-10-19T14:46:25Z"},{"id":"pcd_7744990e8e02bc677939","category":"gpu","name":"VisionTek Radeon HD 6570 VisionTek","normalized_name":"visiontek radeon hd 6570 visiontek","manufacturer":"VisionTek","brand":"VisionTek","series":"Radeon HD 6570","model":"","variant":"VisionTek","aliases":["Radeon HD 6570","VisionTek","VisionTek Radeon HD 6570"],"identifiers":{},"specs":{"opendb_id":"0bb8b4cb-31da-44b5-a1d4-cf90989c7034","chipset_manufacturer":"AMD","chipset":"Radeon HD 6570","core_count":0,"core_base_clock":480,"core_boost_clock":480,"memory":1,"memory_type":"GDDR3","effective_memory_clock":1000,"memory_bus":0,"tdp":40,"interface":"PCIe x16","frame_sync":null,"color":[],"lighting":[],"length":150,"case_expansion_slot_width":1,"total_slot_width":1,"cooling":"1 Fan","power_connectors":{"pcie_6_pin":0,"pcie_8_pin":0,"pcie_12VHPWR":0,"pcie_12V_2x6":0},"video_outputs":{"hdmi_2_1":0,"hdmi_2_0":1,"displayport_2_1":0,"displayport_2_1a":0,"displayport_1_4a":0,"dvi_d":0,"vga":1},"identifiers":{"version":1}},"sources":[{"source":"BuildCores OpenDB","source_path":"GPU/0bb8b4cb-31da-44b5-a1d4-cf90989c7034.json","url":null,"imported_at":"2026-10-19T14:46:25Z"}],"confidence":55,"first_seen":"2026-10-19T14:46:25Z","last_verified":"2026-10-19T14:46:25Z"},{"id":"pcd_f0d25cd6d1f18eedc20c","category":"gpu","name":"Zotac GeForce RTX 3080 10GB Zotac","normalized_name":"zotac geforce rtx 3080 10gb zotac","manufacturer":"Zotac","brand":"Zotac","series":"GeForce RTX 3080 10GB","model":"","variant":"Zotac","aliases":["GeForce RTX 3080 10GB","Zotac","Zotac GeForce RTX 3080 10GB"],"identifiers":{},"specs":{"opendb_id":"c2fd5a51-26a1-46b3-a288-cca89ab07465","chipset_manufacturer":"NVIDIA","chipset":"GeForce RTX 3080 10 GB","core_count":0,"core_base_clock":1440,"core_boost_clock":1770,"memory":10,"memory_type":"GDDR6X","effective_memory_clock":19000,"memory_bus":0,"tdp":340,"interface":"PCIe x16","color":["BLACK"],"lighting":[],"length":318,"total_slot_width":3,"cooling":"3 Fans","power_connectors":{"pcie_6_pin":0,"pcie_8_pin":2,"pcie_12VHPWR":0,"pcie_12V_2x6":0},"video_outputs":{"hdmi_2_1":0,"hdmi_2_0":1,"displayport_2_1":0,"displayport_2_1a":0,"displayport_1_4a":3,"dvi_d":0,"vga":0},"identifiers":{"version":1}},"sources":[{"source":"BuildCores OpenDB","source_path":"GPU/c2fd5a51-26a1-46b3-a288-cca89ab07465.json","url":null,"imported_at":"2026-10-19T14:46:25Z"},{"source":"BuildCores OpenDB","source_path":"GPU/1904f49d-e51d-4dc4-8998-7be2dcbc0b8a.json","url":null,"imported_at":"2026-10-19T14:46:25Z"},{"source":"BuildCores OpenDB","source_path":"GPU/7448079e-e80a-43b8-b826-33d4c728eb36.json","url":null,"imported_at":"2026-10-19T14:46:25Z"},{"source":"BuildCores OpenDB","source_path":"GPU/a4308c8a-f596-4fed-9d48-46a58aa1c7f7.json","url":null,"imported_at":"2026-10-19T14:46:25Z"}],"confidence":79,"first_seen":"2026-10-19T14:46:25Z","last_verified":"2026-10-19T14:46:25Z"}]