[{"id":"pcd_f9d102b718e0b454bf4a","category":"atx-mid-tower","name":"Apevia Genesis Pro","normalized_name":"apevia genesis pro","manufacturer":"","brand":"","series":"","model":"","variant":"White","aliases":[],"identifiers":{},"specs":{"color":"White","psu":null,"side_panel":"Tempered Glass","external_volume":35.7,"internal_35_bays":3},"sources":[{"source":"docyx/pc-part-dataset","source_path":"json/case.json","url":null,"imported_at":"2026-10-12T16:50:12Z"},{"source":"docyx/pc-part-dataset","source_path":"jsonl/case.jsonl","url":null,"imported_at":"2026-10-12T16:50:12Z"}],"confidence":79,"first_seen":"2026-10-12T16:50:12Z","last_verified":"2026-10-12T16:50:12Z"},{"id":"pcd_34b59e7981512aabbf31","category":"atx-mid-tower","name":"Cooler Master MasterBox MB520 RGB","normalized_name":"cooler master masterbox mb520 rgb","manufacturer":"","brand":"","series":"","model":"","variant":"Black","aliases":[],"identifiers":{},"specs":{"color":"Black","psu":null,"side_panel":"Tempered Glass","external_volume":null,"internal_35_bays":2},"sources":[{"source":"docyx/pc-part-dataset","source_path":"json/case.json","url":null,"imported_at":"2026-10-12T16:50:12Z"},{"source":"docyx/pc-part-dataset","source_path":"jsonl/case.jsonl","url":null,"imported_at":"2026-10-12T16:50:12Z"}],"confidence":63,"first_seen":"2026-10-12T16:50:12Z","last_verified":"2026-10-12T16:50:12Z"},{"id":"pcd_652e47eadbdd4fc871bb","category":"atx-mid-tower","name":"Corsair Carbide Series 500R","normalized_name":"corsair carbide series 500r","manufacturer":"","brand":"","series":"","model":"","variant":"Black","aliases":[],"identifiers":{},"specs":{"color":"Black","psu":null,"side_panel":null,"external_volume":54.2,"internal_35_bays":6},"sources":[{"source":"docyx/pc-part-dataset","source_path":"json/case.json","url":null,"imported_at":"2026-10-12T16:50:12Z"},{"source":"docyx/pc-part-dataset","source_path":"jsonl/case.jsonl","url":null,"imported_at":"2026-10-12T16:50:12Z"}],"confidence":71,"first_seen":"2026-10-12T16:50:12Z","last_verified":"2026-10-12T16:50:12Z"},{"id":"pcd_1326c7cd9d274c90807b","category":"atx-mid-tower","name":"Corsair Carbide Series SPEC-04","normalized_name":"corsair carbide series spec-04","manufacturer":"","brand":"","series":"","model":"","variant":"Black / Red","aliases":[],"identifiers":{},"specs":{"color":"Black / Red","psu":null,"side_panel":"Acrylic","external_volume":42.8,"internal_35_bays":3},"sources":[{"source":"docyx/pc-part-dataset","source_path":"json/case.json","url":null,"imported_at":"2026-10-12T16:50:12Z"},{"source":"docyx/pc-part-dataset","source_path":"jsonl/case.jsonl","url":null,"imported_at":"2026-10-12T16:50:12Z"}],"confidence":87,"first_seen":"2026-10-12T16:50:12Z","last_verified":"2026-10-12T16:50:12Z"},{"id":"pcd_18986e3581aeee35292a","category":"atx-mid-tower","name":"DIYPC Mirage-ARGB","normalized_name":"diypc mirage-argb","manufacturer":"","brand":"","series":"","model":"","variant":"Black","aliases":[],"identifiers":{},"specs":{"color":"Black","psu":null,"side_panel":"Tempered Glass","external_volume":38.9,"internal_35_bays":2},"sources":[{"source":"docyx/pc-part-dataset","source_path":"json/case.json","url":null,"imported_at":"2026-10-12T16:50:12Z"},{"source":"docyx/pc-part-dataset","source_path":"jsonl/case.jsonl","url":null,"imported_at":"2026-10-12T16:50:12Z"}],"confidence":63,"first_seen":"2026-10-12T16:50:12Z","last_verified":"2026-10-12T16:50:12Z"},{"id":"pcd_fddbbfff295151da41eb","category":"atx-mid-tower","name":"GAMDIAS TALOS M1 LITE","normalized_name":"gamdias talos m1 lite","manufacturer":"","brand":"","series":"","model":"","variant":"Black","aliases":[],"identifiers":{},"specs":{"color":"Black","psu":null,"side_panel":"Tempered Glass","external_volume":null,"internal_35_bays":2},"sources":[{"source":"docyx/pc-part-dataset","source_path":"json/case.json","url":null,"imported_at":"2026-10-12T16:50:12Z"},{"source":"docyx/pc-part-dataset","source_path":"jsonl/case.jsonl","url":null,"imported_at":"2026-10-12T16:50:12Z"}],"confidence":63,"first_seen":"2026-10-12T16:50:12Z","last_verified":"2026-10-12T16:50:12Z"},{"id":"pcd_e3bfead21b1a9f83c7d4","category":"atx-mid-tower","name":"SHARKOON AK6 RGB","normalized_name":"sharkoon ak6 rgb","manufacturer":"","brand":"","series":"","model":"","variant":"Black","aliases":[],"identifiers":{},"specs":{"color":"Black","psu":null,"side_panel":"Tempered Glass","external_volume":47.5,"internal_35_bays":2},"sources":[{"source":"docyx/pc-part-dataset","source_path":"json/case.json","url":null,"imported_at":"2026-10-12T16:50:12Z"},{"source":"docyx/pc-part-dataset","source_path":"jsonl/case.jsonl","url":null,"imported_at":"2026-10-12T16:50:12Z"}],"confidence":63,"first_seen":"2026-10-12T16:50:12Z","last_verified":"2026-10-12T16:50:12Z"},{"id":"pcd_b3499039c542b7512e47","category":"atx-mid-tower","name":"SHARKOON M25 Silent PCGH Edition","normalized_name":"sharkoon m25 silent pcgh edition","manufacturer":"","brand":"","series":"","model":"","variant":"Black","aliases":[],"identifiers":{},"specs":{"color":"Black","psu":null,"side_panel":null,"external_volume":null,"internal_35_bays":3},"sources":[{"source":"docyx/pc-part-dataset","source_path":"json/case.json","url":null,"imported_at":"2026-10-12T16:50:12Z"},{"source":"docyx/pc-part-dataset","source_path":"jsonl/case.jsonl","url":null,"imported_at":"2026-10-12T16:50:12Z"}],"confidence":63,"first_seen":"2026-10-12T16:50:12Z","last_verified":"2026-10-12T16:50:12Z"},{"id":"pcd_c2f63a5c0fd321d7e560","category":"atx-mid-tower","name":"Thermaltake Soprano","normalized_name":"thermaltake soprano","manufacturer":"","brand":"","series":"","model":"","variant":"Black","aliases":[],"identifiers":{},"specs":{"color":"Black","psu":null,"side_panel":null,"external_volume":51.1,"internal_35_bays":5},"sources":[{"source":"docyx/pc-part-dataset","source_path":"json/case.json","url":null,"imported_at":"2026-10-12T16:50:12Z"},{"source":"docyx/pc-part-dataset","source_path":"jsonl/case.jsonl","url":null,"imported_at":"2026-10-12T16:50:12Z"}],"confidence":63,"first_seen":"2026-10-12T16:50:12Z","last_verified":"2026-10-12T16:50:12Z"}]