[{"id":"pcd_af5635ea86f89c27ce39","category":"webcam","name":"iContact Camera","normalized_name":"icontact camera","manufacturer":"iContact Camera","brand":"iContact Camera","series":"","model":"","variant":"","aliases":[],"identifiers":{},"specs":{"opendb_id":"f3ecf28a-d128-41a7-9f73-2c2d3c58390c","resolution":"4k","frame_rate":"30fps","connectivity_type":["Wired USB-C"],"lighting":[],"identifiers":{"version":1}},"sources":[{"source":"BuildCores OpenDB","source_path":"Webcam/f3ecf28a-d128-41a7-9f73-2c2d3c58390c.json","url":null,"imported_at":"2026-10-12T16:50:12Z"}],"confidence":55,"first_seen":"2026-10-12T16:50:12Z","last_verified":"2026-10-12T16:50:12Z"}]