[{"id":"pcd_3a1c577ec56f6608d924","category":"headphones","name":"Audeze Maxwell 2 ANC XBOX","normalized_name":"audeze maxwell 2 anc xbox","manufacturer":"Audeze","brand":"Audeze","series":"Maxwell","model":"","variant":"2 ANC XBOX","aliases":["Maxwell","Audeze","Audeze Maxwell"],"identifiers":{},"specs":{"opendb_id":"f73b8e41-968b-4585-b5a2-7a08b8f46dc2","driver_size":90,"frequency_response_low":10,"frequency_response_high":50000,"headphone_type":"Closed-Back","ear_cup_type":"Over-Ear","weight":560,"frame_material":"Aluminum","ear_pad_material":["Memory Foam"],"connection_types":["Wired 3.5mm","USB-C","Bluetooth","Wireless 2.4GHz"],"battery_life":40,"bluetooth_version":"5.3","charging_port":"USB-C","wireless_range":45,"latency":15,"has_microphone":true,"microphone_type":"Detachable Boom","noise_cancellation_mic":true,"features":["ANC","Multi-Device Pairing","Spatial Audio","EQ Customization","App Support","Dolby Atmos","Ambient Mode"],"use_cases":["Gaming","Casual","Audiophile"],"platforms":["PC","Mobile","Console"],"lighting":["None"],"general_product_information":{"manufacturer_url":"https://www.audeze.com/products/maxwell-2-anc-wireless-gaming-headset?srsltid=AU7gw4X9OoL6JNHmHeObX3TJYiya_0zrgx1gHcf_EUbarMQQmNZN4Xnq"},"identifiers":{"version":2}},"sources":[{"source":"BuildCores OpenDB","source_path":"Headphones/f73b8e41-968b-4585-b5a2-7a08b8f46dc2.json","url":null,"imported_at":"2026-10-26T14:25:00Z"}],"confidence":55,"first_seen":"2026-10-26T14:25:00Z","last_verified":"2026-10-26T14:25:00Z"},{"id":"pcd_84c07a2d0540c0657105","category":"headphones","name":"Gigabyte","normalized_name":"gigabyte","manufacturer":"Gigabyte","brand":"Gigabyte","series":"","model":"","variant":"","aliases":[],"identifiers":{},"specs":{"opendb_id":"be75c832-9762-4d69-9630-cf9d9af975cd","ear_pad_material":[],"connection_types":[],"features":[],"use_cases":[],"platforms":[],"identifiers":{"version":1},"lighting":[]},"sources":[{"source":"BuildCores OpenDB","source_path":"Headphones/be75c832-9762-4d69-9630-cf9d9af975cd.json","url":null,"imported_at":"2026-10-26T14:25:00Z"},{"source":"BuildCores OpenDB","source_path":"Headphones/a34a822a-ad15-4626-9535-d509589218a6.json","url":null,"imported_at":"2026-10-26T14:25:00Z"},{"source":"BuildCores OpenDB","source_path":"Headphones/dec68a8e-8362-4819-9dc6-1a70b40c0ade.json","url":null,"imported_at":"2026-10-26T14:25:00Z"},{"source":"BuildCores OpenDB","source_path":"Headphones/811a71f5-a70e-4b1a-8731-da995b2c699b.json","url":null,"imported_at":"2026-10-26T14:25:00Z"},{"source":"BuildCores OpenDB","source_path":"Headphones/34ec6efd-999b-434a-bee0-410b6960cc05.json","url":null,"imported_at":"2026-10-26T14:25:00Z"}],"confidence":87,"first_seen":"2026-10-26T14:25:00Z","last_verified":"2026-10-26T14:25:00Z"}]