[{"id":"pcd_f05285d9695d6d7268a7","category":"microatx-mid-tower","name":"Cooler Master MasterBox NR400 (w/ODD)","normalized_name":"cooler master masterbox nr400 w odd","manufacturer":"","brand":"","series":"","model":"","variant":"Black","aliases":[],"identifiers":{},"specs":{"color":"Black","psu":null,"side_panel":"Tempered Glass","external_volume":35.5,"internal_35_bays":4},"sources":[{"source":"docyx/pc-part-dataset","source_path":"json/case.json","url":null,"imported_at":"2026-10-12T16:50:12Z"},{"source":"docyx/pc-part-dataset","source_path":"jsonl/case.jsonl","url":null,"imported_at":"2026-10-12T16:50:12Z"}],"confidence":63,"first_seen":"2026-10-12T16:50:12Z","last_verified":"2026-10-12T16:50:12Z"}]