[{"id":"pcd_8e53ad2750f4996f9af7","category":"mouse","name":"ATTACK SHARK X11 Black With Tape","normalized_name":"attack shark x11 black with tape","manufacturer":"ATTACK SHARK","brand":"ATTACK SHARK","series":"X11","model":"","variant":"Black With Tape","aliases":["X11","ATTACK SHARK","ATTACK SHARK X11"],"identifiers":{},"specs":{"opendb_id":"61662f97-4481-4038-89d8-f8a1461ce71b","weight":63,"dimensions":{"length":128,"width":64,"height":40},"shape":"Symmetrical","handedness":"Right-handed","connectivity":["Wired USB-C","Wireless 2.4GHz","Bluetooth"],"sensor":"PixArt PAW3311 Optical Sensor","max_dpi":22000,"polling_rate":1000,"buttons":5,"switches":"HUANO / HUYU micro switches","switch_type":"Mechanical","onboard_memory":true,"rgb":true,"lighting":["RGB"],"battery_life":65,"battery_type":"Rechargeable","grip_types":["Fingertip","Palm","Claw"],"silent_clicks":false,"general_product_information":{"manufacturer_url":"https://attackshark.com/products/attack-shark-x11-wireless-gaming-mouse-charging-dock?srsltid=AU7gw4VwwPkMHveP2CmN95w6d9I3ZXRW9wgyJUNEXBf5i1MQ3TGfdnps&variant=48491092345130"},"identifiers":{"version":2}},"sources":[{"source":"BuildCores OpenDB","source_path":"Mouse/61662f97-4481-4038-89d8-f8a1461ce71b.json","url":null,"imported_at":"2026-10-19T14:46:25Z"}],"confidence":55,"first_seen":"2026-10-19T14:46:25Z","last_verified":"2026-10-19T14:46:25Z"},{"id":"pcd_8357270586d3185a1b84","category":"mouse","name":"Cherry Xtrfy M64 Pro 8K Wireless","normalized_name":"cherry xtrfy m64 pro 8k wireless","manufacturer":"Cherry Xtrfy","brand":"Cherry Xtrfy","series":"M64 Pro 8K Wireless","model":"","variant":"","aliases":["M64 Pro 8K Wireless","Cherry Xtrfy"],"identifiers":{},"specs":{"opendb_id":"98d44d28-4111-41a3-8b21-6f69e3ec8234","connectivity":["Wireless 2.4GHz"],"lighting":[],"grip_types":[],"identifiers":{"version":1}},"sources":[{"source":"BuildCores OpenDB","source_path":"Mouse/98d44d28-4111-41a3-8b21-6f69e3ec8234.json","url":null,"imported_at":"2026-10-19T14:46:25Z"}],"confidence":55,"first_seen":"2026-10-19T14:46:25Z","last_verified":"2026-10-19T14:46:25Z"},{"id":"pcd_8ccde0cab7d7379683bc","category":"mouse","name":"Xiaomi Wireless Mouse Lite 2 Black","normalized_name":"xiaomi wireless mouse lite 2 black","manufacturer":"Xiaomi","brand":"Xiaomi","series":"Wireless Mouse Lite 2","model":"","variant":"Black","aliases":["Wireless Mouse Lite 2","Xiaomi","Xiaomi Wireless Mouse Lite 2"],"identifiers":{},"specs":{"opendb_id":"f4d37495-1488-4cac-9902-d11c85d74571","connectivity":["Wireless 2.4GHz"],"lighting":[],"grip_types":[],"general_product_information":{"manufacturer_url":"https://www.mi.com/pl/product/xiaomi-wireless-mouse-lite-2/"},"identifiers":{"version":1}},"sources":[{"source":"BuildCores OpenDB","source_path":"Mouse/f4d37495-1488-4cac-9902-d11c85d74571.json","url":null,"imported_at":"2026-10-19T14:46:25Z"}],"confidence":55,"first_seen":"2026-10-19T14:46:25Z","last_verified":"2026-10-19T14:46:25Z"}]