[{"id":"pcd_ec4ac1551fab5e036cc6","category":"microatx-mini-tower","name":"Aerocool CS-107","normalized_name":"aerocool cs-107","manufacturer":"","brand":"","series":"","model":"","variant":"Black","aliases":[],"identifiers":{},"specs":{"color":"Black","psu":null,"side_panel":"Tempered Glass","external_volume":23.7,"internal_35_bays":1},"sources":[{"source":"docyx/pc-part-dataset","source_path":"json/case.json","url":null,"imported_at":"2026-10-26T14:25:00Z"},{"source":"docyx/pc-part-dataset","source_path":"jsonl/case.jsonl","url":null,"imported_at":"2026-10-26T14:25:00Z"}],"confidence":63,"first_seen":"2026-10-26T14:25:00Z","last_verified":"2026-10-26T14:25:00Z"},{"id":"pcd_f38868bb5e76e3107252","category":"microatx-mini-tower","name":"In Win IW-V605T2.CQ350TBL","normalized_name":"in win iw-v605t2.cq350tbl","manufacturer":"","brand":"","series":"","model":"","variant":"Black","aliases":[],"identifiers":{},"specs":{"color":"Black","psu":350,"side_panel":null,"external_volume":22.9,"internal_35_bays":1},"sources":[{"source":"docyx/pc-part-dataset","source_path":"json/case.json","url":null,"imported_at":"2026-10-26T14:25:00Z"},{"source":"docyx/pc-part-dataset","source_path":"jsonl/case.jsonl","url":null,"imported_at":"2026-10-26T14:25:00Z"}],"confidence":63,"first_seen":"2026-10-26T14:25:00Z","last_verified":"2026-10-26T14:25:00Z"}]