[{"id":"pcd_6e9545cc44c02f61bb63","category":"cpu","name":"Intel Core i3 10000 10105F","normalized_name":"intel core i3 10000 10105f","manufacturer":"Intel","brand":"Intel","series":"Core i3 10000","model":"","variant":"10105F","aliases":["Core i3 10000","Intel","Intel Core i3 10000"],"identifiers":{},"specs":{"opendb_id":"b1b42049-0a9c-431b-a545-9deefbbefc6f","microarchitecture":"Comet Lake","coreFamily":"Comet Lake","socket":"LGA 1200","cores":{"total":4,"performance":0,"efficiency":0,"threads":8},"cache":{"l1":"256 KB (4×32 KB L1 Data + 4×32 KB L1 Instruction)","l2":1,"l3":6},"specifications":{"tdp":65,"ppt":0,"eccSupport":false,"includesCooler":true,"packaging":"Boxed","lithography":"14 nm","simultaneousMultithreading":true},"general_product_information":{"manufacturer_url":"https://www.intel.com/content/www/us/en/products/sku/203474/intel-core-i310105f-processor-6m-cache-up-to-4-40-ghz/specifications.html"},"identifiers":{"version":1}},"sources":[{"source":"BuildCores OpenDB","source_path":"CPU/b1b42049-0a9c-431b-a545-9deefbbefc6f.json","url":null,"imported_at":"2026-10-19T14:46:25Z"}],"confidence":55,"first_seen":"2026-10-19T14:46:25Z","last_verified":"2026-10-19T14:46:25Z"},{"id":"pcd_8dee3464ab8dc3d3dd91","category":"cpu","name":"Intel Core i9 9000 9900K","normalized_name":"intel core i9 9000 9900k","manufacturer":"Intel","brand":"Intel","series":"Core i9 9000","model":"","variant":"9900K","aliases":["Core i9 9000","Intel","Intel Core i9 9000"],"identifiers":{},"specs":{"opendb_id":"6988a466-9cf6-491a-98af-d926e9ce608b","microarchitecture":"Coffee Lake Refresh","coreFamily":"Coffee Lake Refresh","socket":"LGA 1151","cores":{"total":8,"performance":0,"efficiency":0,"threads":16},"cache":{"l1":"512 KB (8 × 32 KB Data + 8 × 32 KB Instruction)","l2":2,"l3":16},"specifications":{"tdp":95,"ppt":0,"eccSupport":false,"includesCooler":false,"packaging":"OEM/Tray","lithography":"14 nm","simultaneousMultithreading":true},"general_product_information":{"manufacturer_url":"https://www.intel.com/content/www/us/en/products/sku/186605/intel-core-i99900k-processor-16m-cache-up-to-5-00-ghz/specifications.html"},"identifiers":{"version":1}},"sources":[{"source":"BuildCores OpenDB","source_path":"CPU/6988a466-9cf6-491a-98af-d926e9ce608b.json","url":null,"imported_at":"2026-10-19T14:46:25Z"},{"source":"BuildCores OpenDB","source_path":"CPU/77b34328-7f21-480e-8293-c9f24b25564c.json","url":null,"imported_at":"2026-10-19T14:46:25Z"},{"source":"BuildCores OpenDB","source_path":"CPU/a44808fb-30a8-420c-8ddc-c8cb2645d89e.json","url":null,"imported_at":"2026-10-19T14:46:25Z"}],"confidence":71,"first_seen":"2026-10-19T14:46:25Z","last_verified":"2026-10-19T14:46:25Z"}]