[{"id":"pcd_a33614e8649d94dfef05","category":"gpu","name":"Acer Radeon RX 7800 XT Acer","normalized_name":"acer radeon rx 7800 xt acer","manufacturer":"Acer","brand":"Acer","series":"Radeon RX 7800 XT","model":"","variant":"Acer","aliases":["Radeon RX 7800 XT","Acer","Acer Radeon RX 7800 XT"],"identifiers":{},"specs":{"opendb_id":"5a363d10-6829-47e0-8402-78198d7e9f50","chipset_manufacturer":"AMD","chipset":"Radeon RX 7800 XT","core_count":3840,"core_base_clock":1295,"core_boost_clock":2565,"memory":16,"memory_type":"GDDR6","effective_memory_clock":0,"memory_bus":0,"tdp":263,"interface":"PCIe x16","color":["BLACK"],"lighting":[],"length":279,"total_slot_width":3,"cooling":"2 Fans","power_connectors":{"pcie_6_pin":0,"pcie_8_pin":2,"pcie_12VHPWR":0,"pcie_12V_2x6":0},"video_outputs":{"hdmi_2_1":1,"hdmi_2_0":0,"displayport_2_1":3,"displayport_2_1a":0,"displayport_1_4a":0,"dvi_d":0,"vga":0},"identifiers":{"version":1}},"sources":[{"source":"BuildCores OpenDB","source_path":"GPU/5a363d10-6829-47e0-8402-78198d7e9f50.json","url":null,"imported_at":"2026-10-26T14:25:00Z"},{"source":"BuildCores OpenDB","source_path":"GPU/6f521115-c941-456d-ad16-35300af76124.json","url":null,"imported_at":"2026-10-26T14:25:00Z"}],"confidence":63,"first_seen":"2026-10-26T14:25:00Z","last_verified":"2026-10-26T14:25:00Z"},{"id":"pcd_48b14558a7ef6414fb83","category":"gpu","name":"ASRock Challenger Pro","normalized_name":"asrock challenger pro","manufacturer":"ASRock","brand":"ASRock","series":"Challenger","model":"","variant":"Pro","aliases":["Challenger","ASRock","ASRock Challenger"],"identifiers":{},"specs":{"opendb_id":"75f1326f-7df2-489e-90f6-7bacc5403125","chipset_manufacturer":"AMD","chipset":"Radeon RX 9060 XT 16 GB","core_count":2048,"core_base_clock":1720,"core_boost_clock":3290,"memory":16,"memory_type":"GDDR6","effective_memory_clock":2518,"memory_bus":128,"tdp":160,"interface":"PCIe 5.0 x16","frame_sync":"FreeSync","color":["BLACK","GREY"],"lighting":["ARGB"],"length":290,"case_expansion_slot_width":2,"total_slot_width":2,"cooling":"3 Fans","power_connectors":{"pcie_8_pin":1},"video_outputs":{"hdmi_2_1b":1,"displayport_2_1a":2},"general_product_information":{"manufacturer_url":"https://asrock.com/Graphics-Card/AMD/Radeon%20RX%209060%20XT%20Challenger%20Pro%2016GB%20OC/#Specification"},"identifiers":{"version":1}},"sources":[{"source":"BuildCores OpenDB","source_path":"GPU/75f1326f-7df2-489e-90f6-7bacc5403125.json","url":null,"imported_at":"2026-10-26T14:25:00Z"}],"confidence":55,"first_seen":"2026-10-26T14:25:00Z","last_verified":"2026-10-26T14:25:00Z"},{"id":"pcd_1d6dac1d166b1050bcb4","category":"gpu","name":"ASUS ROG Astral OC","normalized_name":"asus rog astral oc","manufacturer":"ASUS","brand":"ASUS","series":"ROG","model":"","variant":"Astral OC","aliases":["ROG","ASUS","ASUS ROG"],"identifiers":{},"specs":{"opendb_id":"daf3c80e-9368-440e-a309-a7cde364a84b","chipset_manufacturer":"NVIDIA","chipset":"GeForce RTX 5080","core_count":10752,"core_base_clock":2295,"core_boost_clock":2760,"memory":16,"memory_type":"GDDR7","effective_memory_clock":1875,"memory_bus":256,"tdp":360,"interface":"PCIe 5.0 x16","frame_sync":"G-Sync","color":["BLACK","RGB","GREY"],"lighting":["ARGB"],"length":358,"case_expansion_slot_width":2,"total_slot_width":3.8,"cooling":"4 Fans","power_connectors":{"pcie_6_pin":0,"pcie_8_pin":0,"pcie_12VHPWR":0,"pcie_12V_2x6":1},"video_outputs":{"hdmi_2_2":0,"hdmi_2_1":0,"hdmi_2_1a":0,"hdmi_2_1b":2,"hdmi_2_0":0,"hdmi_2_0a":0,"hdmi_2_0b":0,"displayport_2_1":0,"displayport_2_1a":0,"displayport_1_4a":0,"displayport_2_1_b":3,"usb_c":0,"dvi_d":0,"vga":0},"general_product_information":{"manufacturer_url":"https://rog.asus.com/graphics-cards/graphics-cards/rog-astral/rog-astral-rtx5080-o16g-gaming/"},"identifiers":{"version":1}},"sources":[{"source":"BuildCores OpenDB","source_path":"GPU/daf3c80e-9368-440e-a309-a7cde364a84b.json","url":null,"imported_at":"2026-10-26T14:25:00Z"},{"source":"BuildCores OpenDB","source_path":"GPU/8093bff2-3d49-4bd6-8158-bf5082b87fea.json","url":null,"imported_at":"2026-10-26T14:25:00Z"},{"source":"BuildCores OpenDB","source_path":"GPU/ff319243-38ee-4031-ac17-88dd1e91d5cc.json","url":null,"imported_at":"2026-10-26T14:25:00Z"}],"confidence":71,"first_seen":"2026-10-26T14:25:00Z","last_verified":"2026-10-26T14:25:00Z"},{"id":"pcd_047815d2c04e588981b4","category":"gpu","name":"EVGA RTX 2080 FTW3 Ultra","normalized_name":"evga rtx 2080 ftw3 ultra","manufacturer":"EVGA","brand":"EVGA","series":"RTX 2080","model":"","variant":"FTW3 Ultra","aliases":["RTX 2080","EVGA","EVGA RTX 2080"],"identifiers":{},"specs":{"opendb_id":"e873fd98-f133-4322-8925-49b9734925c3","chipset_manufacturer":"NVIDIA","chipset":"GeForce RTX 2080","core_base_clock":1515,"core_boost_clock":1860,"memory":8,"memory_type":"GDDR6","effective_memory_clock":14000,"memory_bus":256,"tdp":215,"interface":"PCIe 3.0 x16","frame_sync":null,"color":[],"lighting":[],"length":301.925,"case_expansion_slot_width":2.75,"total_slot_width":3,"cooling":"3 Fans","power_connectors":{"pcie_6_pin":1,"pcie_8_pin":1,"pcie_12VHPWR":0,"pcie_12V_2x6":0},"video_outputs":{"hdmi_2_1":0,"hdmi_2_0":1,"displayport_2_1":0,"displayport_2_1a":0,"displayport_1_4a":3,"dvi_d":0,"vga":0},"identifiers":{"version":1}},"sources":[{"source":"BuildCores OpenDB","source_path":"GPU/e873fd98-f133-4322-8925-49b9734925c3.json","url":null,"imported_at":"2026-10-26T14:25:00Z"}],"confidence":55,"first_seen":"2026-10-26T14:25:00Z","last_verified":"2026-10-26T14:25:00Z"},{"id":"pcd_39d06de74e37abb65cf5","category":"gpu","name":"Zotac GeForce RTX 3070 Ti Zotac","normalized_name":"zotac geforce rtx 3070 ti zotac","manufacturer":"Zotac","brand":"Zotac","series":"GeForce RTX 3070 Ti","model":"","variant":"Zotac","aliases":["GeForce RTX 3070 Ti","Zotac","Zotac GeForce RTX 3070 Ti"],"identifiers":{},"specs":{"opendb_id":"bfe2779c-d0cd-4b62-bbbe-660382b1bd9a","chipset_manufacturer":"NVIDIA","chipset":"GeForce RTX 3070 Ti","core_count":6144,"core_base_clock":1575,"core_boost_clock":1770,"memory":8,"memory_type":"GDDR6X","effective_memory_clock":0,"memory_bus":0,"tdp":320,"interface":"PCIe x16","color":["BLACK"],"lighting":[],"length":318,"total_slot_width":3,"cooling":"3 Fans","power_connectors":{"pcie_6_pin":0,"pcie_8_pin":2,"pcie_12VHPWR":0,"pcie_12V_2x6":0},"video_outputs":{"hdmi_2_1":1,"hdmi_2_0":0,"displayport_2_1":0,"displayport_2_1a":0,"displayport_1_4a":3,"dvi_d":0,"vga":0},"identifiers":{"version":1}},"sources":[{"source":"BuildCores OpenDB","source_path":"GPU/bfe2779c-d0cd-4b62-bbbe-660382b1bd9a.json","url":null,"imported_at":"2026-10-26T14:25:00Z"},{"source":"BuildCores OpenDB","source_path":"GPU/de88415e-f82a-411b-8906-9c403b8df407.json","url":null,"imported_at":"2026-10-26T14:25:00Z"},{"source":"BuildCores OpenDB","source_path":"GPU/0e9dc8a9-bd49-401f-8a15-6a6889cff544.json","url":null,"imported_at":"2026-10-26T14:25:00Z"},{"source":"BuildCores OpenDB","source_path":"GPU/b74f1039-9955-4f11-93ec-2de512dda32c.json","url":null,"imported_at":"2026-10-26T14:25:00Z"},{"source":"BuildCores OpenDB","source_path":"GPU/37f14819-d431-44fa-b16b-db0ac94b2ccd.json","url":null,"imported_at":"2026-10-26T14:25:00Z"}],"confidence":87,"first_seen":"2026-10-26T14:25:00Z","last_verified":"2026-10-26T14:25:00Z"}]