[{"id":"pcd_003ecabcc86a4aeddc7d","category":"mini-itx-tower","name":"Silverstone CS01-HS","normalized_name":"silverstone cs01-hs","manufacturer":"","brand":"","series":"","model":"","variant":"Black","aliases":[],"identifiers":{},"specs":{"color":"Black","psu":null,"side_panel":null,"external_volume":null,"internal_35_bays":0},"sources":[{"source":"docyx/pc-part-dataset","source_path":"json/case.json","url":null,"imported_at":"2026-10-12T16:50:12Z"},{"source":"docyx/pc-part-dataset","source_path":"jsonl/case.jsonl","url":null,"imported_at":"2026-10-12T16:50:12Z"}],"confidence":71,"first_seen":"2026-10-12T16:50:12Z","last_verified":"2026-10-12T16:50:12Z"}]