[{"id":"pcd_69d74a58ba64270aaebe","category":"portable","name":"Seagate GoFlex for Mac","normalized_name":"seagate goflex for mac","manufacturer":"","brand":"","series":"","model":"","variant":"","aliases":[],"identifiers":{},"specs":{"interface":"Thunderbolt","capacity":1000,"price_per_gb":null,"color":null},"sources":[{"source":"docyx/pc-part-dataset","source_path":"json/external-hard-drive.json","url":null,"imported_at":"2026-10-26T14:25:00Z"},{"source":"docyx/pc-part-dataset","source_path":"jsonl/external-hard-drive.jsonl","url":null,"imported_at":"2026-10-26T14:25:00Z"}],"confidence":63,"first_seen":"2026-10-26T14:25:00Z","last_verified":"2026-10-26T14:25:00Z"}]