[{"id":"pcd_a2df7ed27a8198793aa3","category":"atx-mid-tower","name":"Aerocool P7-C0","normalized_name":"aerocool p7-c0","manufacturer":"","brand":"","series":"","model":"","variant":"Black","aliases":[],"identifiers":{},"specs":{"color":"Black","psu":null,"side_panel":"Tempered Glass","external_volume":null,"internal_35_bays":2},"sources":[{"source":"docyx/pc-part-dataset","source_path":"json/case.json","url":null,"imported_at":"2026-10-26T14:25:00Z"},{"source":"docyx/pc-part-dataset","source_path":"jsonl/case.jsonl","url":null,"imported_at":"2026-10-26T14:25:00Z"}],"confidence":63,"first_seen":"2026-10-26T14:25:00Z","last_verified":"2026-10-26T14:25:00Z"},{"id":"pcd_19025097bdb9eb679097","category":"atx-mid-tower","name":"BitFenix FLOW","normalized_name":"bitfenix flow","manufacturer":"","brand":"","series":"","model":"","variant":"Black","aliases":[],"identifiers":{},"specs":{"color":"Black","psu":null,"side_panel":"Tempered Glass","external_volume":42.3,"internal_35_bays":2},"sources":[{"source":"docyx/pc-part-dataset","source_path":"json/case.json","url":null,"imported_at":"2026-10-26T14:25:00Z"},{"source":"docyx/pc-part-dataset","source_path":"jsonl/case.jsonl","url":null,"imported_at":"2026-10-26T14:25:00Z"}],"confidence":71,"first_seen":"2026-10-26T14:25:00Z","last_verified":"2026-10-26T14:25:00Z"},{"id":"pcd_f4d6f147ee0b1622de81","category":"atx-mid-tower","name":"BitFenix TRITON","normalized_name":"bitfenix triton","manufacturer":"","brand":"","series":"","model":"","variant":"Black","aliases":[],"identifiers":{},"specs":{"color":"Black","psu":null,"side_panel":"Tempered Glass","external_volume":45.1,"internal_35_bays":2},"sources":[{"source":"docyx/pc-part-dataset","source_path":"json/case.json","url":null,"imported_at":"2026-10-26T14:25:00Z"},{"source":"docyx/pc-part-dataset","source_path":"jsonl/case.jsonl","url":null,"imported_at":"2026-10-26T14:25:00Z"}],"confidence":71,"first_seen":"2026-10-26T14:25:00Z","last_verified":"2026-10-26T14:25:00Z"},{"id":"pcd_d45a9148b642596ec5f7","category":"atx-mid-tower","name":"Cougar MX330-F","normalized_name":"cougar mx330-f","manufacturer":"","brand":"","series":"","model":"","variant":"Black","aliases":[],"identifiers":{},"specs":{"color":"Black","psu":null,"side_panel":"Acrylic","external_volume":39.4,"internal_35_bays":2},"sources":[{"source":"docyx/pc-part-dataset","source_path":"json/case.json","url":null,"imported_at":"2026-10-26T14:25:00Z"},{"source":"docyx/pc-part-dataset","source_path":"jsonl/case.jsonl","url":null,"imported_at":"2026-10-26T14:25:00Z"}],"confidence":63,"first_seen":"2026-10-26T14:25:00Z","last_verified":"2026-10-26T14:25:00Z"},{"id":"pcd_1e5145b21987c89b3d4d","category":"atx-mid-tower","name":"DIYPC DIY-J21","normalized_name":"diypc diy-j21","manufacturer":"","brand":"","series":"","model":"","variant":"Black","aliases":[],"identifiers":{},"specs":{"color":"Black","psu":null,"side_panel":"Acrylic","external_volume":null,"internal_35_bays":3},"sources":[{"source":"docyx/pc-part-dataset","source_path":"json/case.json","url":null,"imported_at":"2026-10-26T14:25:00Z"},{"source":"docyx/pc-part-dataset","source_path":"jsonl/case.jsonl","url":null,"imported_at":"2026-10-26T14:25:00Z"}],"confidence":71,"first_seen":"2026-10-26T14:25:00Z","last_verified":"2026-10-26T14:25:00Z"},{"id":"pcd_1b310c86be59be651cf8","category":"atx-mid-tower","name":"Enermax StarryKnight SK30 V2","normalized_name":"enermax starryknight sk30 v2","manufacturer":"","brand":"","series":"","model":"","variant":"Black","aliases":[],"identifiers":{},"specs":{"color":"Black","psu":null,"side_panel":"Tempered Glass","external_volume":49.7,"internal_35_bays":2},"sources":[{"source":"docyx/pc-part-dataset","source_path":"json/case.json","url":null,"imported_at":"2026-10-26T14:25:00Z"},{"source":"docyx/pc-part-dataset","source_path":"jsonl/case.jsonl","url":null,"imported_at":"2026-10-26T14:25:00Z"}],"confidence":63,"first_seen":"2026-10-26T14:25:00Z","last_verified":"2026-10-26T14:25:00Z"},{"id":"pcd_ee9a22633506abba116d","category":"atx-mid-tower","name":"GameMax Phantom","normalized_name":"gamemax phantom","manufacturer":"","brand":"","series":"","model":"","variant":"Black","aliases":[],"identifiers":{},"specs":{"color":"Black","psu":null,"side_panel":"Tempered Glass","external_volume":39.7,"internal_35_bays":1},"sources":[{"source":"docyx/pc-part-dataset","source_path":"json/case.json","url":null,"imported_at":"2026-10-26T14:25:00Z"},{"source":"docyx/pc-part-dataset","source_path":"jsonl/case.jsonl","url":null,"imported_at":"2026-10-26T14:25:00Z"}],"confidence":63,"first_seen":"2026-10-26T14:25:00Z","last_verified":"2026-10-26T14:25:00Z"},{"id":"pcd_ff2762214734e50071fc","category":"atx-mid-tower","name":"Raidmax Viper GX","normalized_name":"raidmax viper gx","manufacturer":"","brand":"","series":"","model":"","variant":"Black / Green","aliases":[],"identifiers":{},"specs":{"color":"Black / Green","psu":null,"side_panel":null,"external_volume":65.3,"internal_35_bays":7},"sources":[{"source":"docyx/pc-part-dataset","source_path":"json/case.json","url":null,"imported_at":"2026-10-26T14:25:00Z"},{"source":"docyx/pc-part-dataset","source_path":"jsonl/case.jsonl","url":null,"imported_at":"2026-10-26T14:25:00Z"}],"confidence":71,"first_seen":"2026-10-26T14:25:00Z","last_verified":"2026-10-26T14:25:00Z"},{"id":"pcd_36eb7b4d40402c506e53","category":"atx-mid-tower","name":"Thermaltake Versa G1","normalized_name":"thermaltake versa g1","manufacturer":"","brand":"","series":"","model":"","variant":"Black","aliases":[],"identifiers":{},"specs":{"color":"Black","psu":null,"side_panel":"Acrylic","external_volume":40.1,"internal_35_bays":5},"sources":[{"source":"docyx/pc-part-dataset","source_path":"json/case.json","url":null,"imported_at":"2026-10-26T14:25:00Z"},{"source":"docyx/pc-part-dataset","source_path":"jsonl/case.jsonl","url":null,"imported_at":"2026-10-26T14:25:00Z"}],"confidence":63,"first_seen":"2026-10-26T14:25:00Z","last_verified":"2026-10-26T14:25:00Z"},{"id":"pcd_4b00b95495baa2b74466","category":"atx-mid-tower","name":"Xigmatek Midgard II","normalized_name":"xigmatek midgard ii","manufacturer":"","brand":"","series":"","model":"","variant":"Black","aliases":[],"identifiers":{},"specs":{"color":"Black","psu":null,"side_panel":null,"external_volume":45.4,"internal_35_bays":6},"sources":[{"source":"docyx/pc-part-dataset","source_path":"json/case.json","url":null,"imported_at":"2026-10-26T14:25:00Z"},{"source":"docyx/pc-part-dataset","source_path":"jsonl/case.jsonl","url":null,"imported_at":"2026-10-26T14:25:00Z"}],"confidence":63,"first_seen":"2026-10-26T14:25:00Z","last_verified":"2026-10-26T14:25:00Z"}]