[{"id":"pcd_c30886120ad175ab5f3f","category":"gpu","name":"ASUS Radeon RX 7800 XT Asus","normalized_name":"asus radeon rx 7800 xt asus","manufacturer":"ASUS","brand":"ASUS","series":"Radeon RX 7800 XT","model":"","variant":"Asus","aliases":["Radeon RX 7800 XT","ASUS","ASUS Radeon RX 7800 XT"],"identifiers":{},"specs":{"opendb_id":"9c6f381b-0a38-43c2-8694-3a9f9cfa2084","chipset_manufacturer":"AMD","chipset":"Radeon RX 7800 XT","core_count":3840,"core_base_clock":1295,"core_boost_clock":2520,"memory":16,"memory_type":"GDDR6","effective_memory_clock":0,"memory_bus":0,"tdp":263,"interface":"PCIe x16","color":["BLACK"],"lighting":[],"length":280,"total_slot_width":3,"cooling":"2 Fans","power_connectors":{"pcie_6_pin":0,"pcie_8_pin":0,"pcie_12VHPWR":0,"pcie_12V_2x6":0},"video_outputs":{"hdmi_2_1":1,"hdmi_2_0":0,"displayport_2_1":3,"displayport_2_1a":0,"displayport_1_4a":0,"dvi_d":0,"vga":0},"identifiers":{"version":1}},"sources":[{"source":"BuildCores OpenDB","source_path":"GPU/9c6f381b-0a38-43c2-8694-3a9f9cfa2084.json","url":null,"imported_at":"2026-10-12T16:50:12Z"},{"source":"BuildCores OpenDB","source_path":"GPU/2d38b1c6-0102-419f-9d6a-754fabca142b.json","url":null,"imported_at":"2026-10-12T16:50:12Z"},{"source":"BuildCores OpenDB","source_path":"GPU/fe5ccad5-c92f-4869-996e-3343b5afd585.json","url":null,"imported_at":"2026-10-12T16:50:12Z"}],"confidence":71,"first_seen":"2026-10-12T16:50:12Z","last_verified":"2026-10-12T16:50:12Z"},{"id":"pcd_7a2377a238d02ef31002","category":"gpu","name":"Gigabyte AORUS ELITE 12G","normalized_name":"gigabyte aorus elite 12g","manufacturer":"Gigabyte","brand":"Gigabyte","series":"AORUS ELITE","model":"","variant":"12G","aliases":["AORUS ELITE","Gigabyte","Gigabyte AORUS ELITE"],"identifiers":{},"specs":{"opendb_id":"8f64dc32-aaa1-427b-9090-92665a204141","chipset_manufacturer":"NVIDIA","chipset":"GeForce RTX 4070 Ti","core_count":7680,"core_base_clock":2610,"core_boost_clock":2655,"memory":12,"memory_type":"GDDR6X","effective_memory_clock":21000,"memory_bus":192,"tdp":285,"interface":"PCIe 4.0 x16","frame_sync":null,"color":[],"lighting":[],"length":336,"case_expansion_slot_width":2,"total_slot_width":0,"cooling":"3 Fans","power_connectors":{"pcie_6_pin":0,"pcie_8_pin":0,"pcie_12VHPWR":1,"pcie_12V_2x6":0},"video_outputs":{"hdmi_2_1":1,"hdmi_2_0":0,"displayport_2_1":0,"displayport_2_1a":0,"displayport_1_4a":3,"dvi_d":0,"vga":0},"identifiers":{"version":1}},"sources":[{"source":"BuildCores OpenDB","source_path":"GPU/8f64dc32-aaa1-427b-9090-92665a204141.json","url":null,"imported_at":"2026-10-12T16:50:12Z"}],"confidence":55,"first_seen":"2026-10-12T16:50:12Z","last_verified":"2026-10-12T16:50:12Z"},{"id":"pcd_2f3aa2a030799d82deb1","category":"gpu","name":"Gigabyte Eagle OC","normalized_name":"gigabyte eagle oc","manufacturer":"Gigabyte","brand":"Gigabyte","series":"Eagle","model":"","variant":"OC","aliases":["Eagle","Gigabyte","Gigabyte Eagle","EAGLE","Gigabyte EAGLE"],"identifiers":{},"specs":{"opendb_id":"065f309c-bf41-406d-bfcd-5123917539cd","chipset_manufacturer":"NVIDIA","chipset":"GeForce GTX 1650","core_count":4608,"core_base_clock":1815,"core_boost_clock":1815,"memory":4,"memory_type":"GDDR6","effective_memory_clock":12000,"memory_bus":128,"tdp":85,"interface":"PCIe 3.0 x16","frame_sync":null,"color":[],"lighting":[],"length":212,"case_expansion_slot_width":2,"total_slot_width":2,"cooling":"2 Fans","power_connectors":{"pcie_6_pin":1,"pcie_8_pin":0,"pcie_12VHPWR":0,"pcie_12V_2x6":0},"video_outputs":{"hdmi_2_1":0,"hdmi_2_0":1,"displayport_2_1":0,"displayport_2_1a":0,"displayport_1_4a":1,"dvi_d":1,"vga":0},"general_product_information":{"manufacturer_url":"https://www.gigabyte.com/Graphics-Card/GV-N506TEAGLEOC-ICE-8GD/sp"},"identifiers":{"version":1}},"sources":[{"source":"BuildCores OpenDB","source_path":"GPU/065f309c-bf41-406d-bfcd-5123917539cd.json","url":null,"imported_at":"2026-10-12T16:50:12Z"},{"source":"BuildCores OpenDB","source_path":"GPU/4f68d856-8fd8-427a-8fbf-9a50cef1bd66.json","url":null,"imported_at":"2026-10-12T16:50:12Z"},{"source":"BuildCores OpenDB","source_path":"GPU/46c2866b-97e5-4da2-ae07-5a7555a850f5.json","url":null,"imported_at":"2026-10-12T16:50:12Z"},{"source":"BuildCores OpenDB","source_path":"GPU/7c1ca320-a798-4038-822c-85cb5a44dbbd.json","url":null,"imported_at":"2026-10-12T16:50:12Z"},{"source":"BuildCores OpenDB","source_path":"GPU/25624b04-37bf-4eaf-8258-9ba81a257e37.json","url":null,"imported_at":"2026-10-12T16:50:12Z"},{"source":"BuildCores OpenDB","source_path":"GPU/4168f8e8-9310-4477-816c-a9062b3f9811.json","url":null,"imported_at":"2026-10-12T16:50:12Z"},{"source":"BuildCores OpenDB","source_path":"GPU/a2af4107-1240-46ba-89df-1916a1e9dd0d.json","url":null,"imported_at":"2026-10-12T16:50:12Z"},{"source":"BuildCores OpenDB","source_path":"GPU/49faaf91-a3f6-4327-8af3-b3072e310ed1.json","url":null,"imported_at":"2026-10-12T16:50:12Z"},{"source":"BuildCores OpenDB","source_path":"GPU/37417da0-8261-416f-b7e0-6dd55fca17ac.json","url":null,"imported_at":"2026-10-12T16:50:12Z"},{"source":"BuildCores OpenDB","source_path":"GPU/92f8d2b0-ccba-462f-8484-ed9b65d3fc13.json","url":null,"imported_at":"2026-10-12T16:50:12Z"},{"source":"BuildCores OpenDB","source_path":"GPU/4a1160ee-cb86-45d2-8c34-0838ac940c11.json","url":null,"imported_at":"2026-10-12T16:50:12Z"}],"confidence":99,"first_seen":"2026-10-12T16:50:12Z","last_verified":"2026-10-12T16:50:12Z"},{"id":"pcd_35411425c5ab8ff63635","category":"gpu","name":"MSI GeForce RTX 2060 VENTUS GP 12G OC","normalized_name":"msi geforce rtx 2060 ventus gp 12g oc","manufacturer":"MSI","brand":"MSI","series":"GeForce RTX 2060 VENTUS","model":"","variant":"GP 12G OC","aliases":["GeForce RTX 2060 VENTUS","MSI","MSI GeForce RTX 2060 VENTUS"],"identifiers":{},"specs":{"opendb_id":"4cf8faf1-470e-4516-8ad6-01125c15c4a8","chipset_manufacturer":"NVIDIA","chipset":"GeForce RTX 2060","core_count":0,"core_base_clock":0,"core_boost_clock":1695,"memory":12,"memory_type":"GDDR6","effective_memory_clock":14000,"memory_bus":192,"tdp":184,"interface":"PCIe 3.0 x16","frame_sync":"G-Sync","color":[],"lighting":[],"length":258,"case_expansion_slot_width":2,"total_slot_width":2,"cooling":"2 Fans","power_connectors":{"pcie_6_pin":1,"pcie_8_pin":1,"pcie_12VHPWR":0,"pcie_12V_2x6":0},"video_outputs":{"hdmi_2_1":0,"hdmi_2_0":1,"displayport_2_1":0,"displayport_2_1a":0,"displayport_1_4a":3,"dvi_d":0,"vga":0},"identifiers":{"version":1}},"sources":[{"source":"BuildCores OpenDB","source_path":"GPU/4cf8faf1-470e-4516-8ad6-01125c15c4a8.json","url":null,"imported_at":"2026-10-12T16:50:12Z"}],"confidence":55,"first_seen":"2026-10-12T16:50:12Z","last_verified":"2026-10-12T16:50:12Z"}]