[{"id":"pcd_2453dffd4c7d8eab4882","category":"monitor","name":"Dell SE2426H","normalized_name":"dell se2426h","manufacturer":"Dell","brand":"Dell","series":"SE2426H","model":"","variant":"","aliases":["SE2426H","Dell"],"identifiers":{},"specs":{"opendb_id":"96b33fc6-eb3a-4014-8d8b-ad8bf42c9232","resolution":{"horizontalRes":1920,"verticalRes":1080},"refresh_rate":144,"panel_type":"IPS","response_time":1,"color":[],"lighting":[],"aspect_ratio":"16:9","connectors":"HDMI","adaptive_sync":"FreeSync","identifiers":{"version":1}},"sources":[{"source":"BuildCores OpenDB","source_path":"Monitor/96b33fc6-eb3a-4014-8d8b-ad8bf42c9232.json","url":null,"imported_at":"2026-10-26T14:25:00Z"}],"confidence":55,"first_seen":"2026-10-26T14:25:00Z","last_verified":"2026-10-26T14:25:00Z"},{"id":"pcd_e320a371a2cf14c0f33e","category":"monitor","name":"Nixeus Black","normalized_name":"nixeus black","manufacturer":"Nixeus","brand":"Nixeus","series":"","model":"","variant":"Black","aliases":["Nixeus"],"identifiers":{},"specs":{"opendb_id":"00e5b414-5630-4893-86a8-f37a93c3902d","screen_size":27,"resolution":{"horizontalRes":2560,"verticalRes":1440},"refresh_rate":144,"panel_type":"AHVA","response_time":4,"color":["BLACK"],"lighting":[],"viewing_angle":"178° H x 178° V","aspect_ratio":"16:9","connectors":"2 x HDMI                                                    2 x DisplayPort","max_brightness":300,"hdr":"","adaptive_sync":"FreeSync","identifiers":{"version":1}},"sources":[{"source":"BuildCores OpenDB","source_path":"Monitor/00e5b414-5630-4893-86a8-f37a93c3902d.json","url":null,"imported_at":"2026-10-26T14:25:00Z"},{"source":"BuildCores OpenDB","source_path":"Monitor/69874921-0777-4cff-a149-9e3bdd968494.json","url":null,"imported_at":"2026-10-26T14:25:00Z"},{"source":"BuildCores OpenDB","source_path":"Monitor/b2446018-aa90-4e39-b0a7-1d47fe065734.json","url":null,"imported_at":"2026-10-26T14:25:00Z"}],"confidence":71,"first_seen":"2026-10-26T14:25:00Z","last_verified":"2026-10-26T14:25:00Z"},{"id":"pcd_854aa13589a3b2f925dd","category":"monitor","name":"Samsung Black / Blue","normalized_name":"samsung black blue","manufacturer":"Samsung","brand":"Samsung","series":"","model":"","variant":"Black / Blue","aliases":["Samsung"],"identifiers":{},"specs":{"opendb_id":"b8521c38-e2e9-4ec6-ad0a-91b284d88785","screen_size":28,"resolution":{"horizontalRes":3840,"verticalRes":2160},"refresh_rate":144,"panel_type":"IPS","response_time":1,"color":["BLACK","BLUE"],"lighting":[],"viewing_angle":"178° H x 178° V","aspect_ratio":"16:9","connectors":"2 x HDMI 2.1                                                    1 x DisplayPort 1.4","max_brightness":400,"hdr":"","adaptive_sync":"FreeSync Premium Pro","identifiers":{"version":1}},"sources":[{"source":"BuildCores OpenDB","source_path":"Monitor/b8521c38-e2e9-4ec6-ad0a-91b284d88785.json","url":null,"imported_at":"2026-10-26T14:25:00Z"}],"confidence":55,"first_seen":"2026-10-26T14:25:00Z","last_verified":"2026-10-26T14:25:00Z"},{"id":"pcd_87fbc4e55fd051cb1e66","category":"monitor","name":"VIOTEK","normalized_name":"viotek","manufacturer":"VIOTEK","brand":"VIOTEK","series":"","model":"","variant":"","aliases":[],"identifiers":{},"specs":{"opendb_id":"0b01025e-d8f4-40c4-ad73-18fb4669bb71","screen_size":32,"resolution":{"horizontalRes":1920,"verticalRes":1080},"refresh_rate":60,"panel_type":null,"response_time":0,"color":[],"lighting":[],"viewing_angle":"","aspect_ratio":"16:9","connectors":"1 x HDMI                                                    1 x DVI-D Dual Link                                                    1 x VGA","hdr":"","adaptive_sync":"None","identifiers":{"version":1}},"sources":[{"source":"BuildCores OpenDB","source_path":"Monitor/0b01025e-d8f4-40c4-ad73-18fb4669bb71.json","url":null,"imported_at":"2026-10-26T14:25:00Z"},{"source":"BuildCores OpenDB","source_path":"Monitor/f93adfda-e60c-4860-a286-b1f4771690f8.json","url":null,"imported_at":"2026-10-26T14:25:00Z"}],"confidence":63,"first_seen":"2026-10-26T14:25:00Z","last_verified":"2026-10-26T14:25:00Z"}]