[{"id":"pcd_85e257d17e7699cc94a3","category":"psu","name":"Antec Earthwatts 650W Bronze","normalized_name":"antec earthwatts 650w bronze","manufacturer":"Antec","brand":"Antec","series":"Earthwatts","model":"","variant":"650W Bronze","aliases":["Earthwatts","Antec","Antec Earthwatts"],"identifiers":{},"specs":{"opendb_id":"f30a1547-aa33-4566-ab6d-2555d5d20259","wattage":650,"form_factor":"ATX","efficiency_rating":"80+ Bronze","modular":"Non-Modular","color":[],"lighting":[],"length":154,"fanless":false,"connectors":{"atx_24_pin":1,"eps_8_pin":1,"pcie_12vhpwr":0,"pcie_6_plus_2_pin":2,"sata":7,"molex_4_pin":5,"floppy_4_pin":0},"identifiers":{"version":1}},"sources":[{"source":"BuildCores OpenDB","source_path":"PSU/f30a1547-aa33-4566-ab6d-2555d5d20259.json","url":null,"imported_at":"2026-10-19T14:46:25Z"}],"confidence":55,"first_seen":"2026-10-19T14:46:25Z","last_verified":"2026-10-19T14:46:25Z"},{"id":"pcd_e7e785caa3cc202a9c07","category":"psu","name":"Apevia Galaxy 850W Gold","normalized_name":"apevia galaxy 850w gold","manufacturer":"Apevia","brand":"Apevia","series":"Galaxy","model":"","variant":"850W Gold","aliases":["Galaxy","Apevia","Apevia Galaxy"],"identifiers":{},"specs":{"opendb_id":"7b1772e6-dccf-4281-be8f-cc2fe83a590f","wattage":850,"form_factor":"ATX","efficiency_rating":"80+ Gold","modular":"Semi-Modular","color":["BLACK"],"lighting":[],"length":160,"fanless":false,"connectors":{"atx_24_pin":1,"eps_8_pin":0,"pcie_12vhpwr":0,"pcie_6_plus_2_pin":0,"sata":4,"molex_4_pin":0,"floppy_4_pin":0},"identifiers":{"version":1}},"sources":[{"source":"BuildCores OpenDB","source_path":"PSU/7b1772e6-dccf-4281-be8f-cc2fe83a590f.json","url":null,"imported_at":"2026-10-19T14:46:25Z"}],"confidence":55,"first_seen":"2026-10-19T14:46:25Z","last_verified":"2026-10-19T14:46:25Z"},{"id":"pcd_ecfebecb228c0adf4de6","category":"psu","name":"Azza PSAZ-850PT14 850W Platinum","normalized_name":"azza psaz-850pt14 850w platinum","manufacturer":"Azza","brand":"Azza","series":"PSAZ-850PT14","model":"","variant":"850W Platinum","aliases":["PSAZ-850PT14","Azza","Azza PSAZ-850PT14"],"identifiers":{},"specs":{"opendb_id":"b85677d9-2d02-4fd0-b842-1ad850c66add","wattage":850,"form_factor":"ATX","efficiency_rating":"80+ Platinum","modular":"Semi-Modular","color":[],"lighting":[],"length":180,"fanless":false,"connectors":{"atx_24_pin":1,"eps_8_pin":1,"pcie_12vhpwr":0,"pcie_6_plus_2_pin":4,"sata":8,"molex_4_pin":5,"floppy_4_pin":0},"identifiers":{"version":1}},"sources":[{"source":"BuildCores OpenDB","source_path":"PSU/b85677d9-2d02-4fd0-b842-1ad850c66add.json","url":null,"imported_at":"2026-10-19T14:46:25Z"}],"confidence":55,"first_seen":"2026-10-19T14:46:25Z","last_verified":"2026-10-19T14:46:25Z"},{"id":"pcd_95883100be180100392c","category":"psu","name":"be quiet! Pure Power 10 600W CM","normalized_name":"be quiet pure power 10 600w cm","manufacturer":"be quiet!","brand":"be quiet!","series":"Pure Power 10","model":"","variant":"600W CM","aliases":["Pure Power 10","be quiet!","be quiet! Pure Power 10"],"identifiers":{},"specs":{"opendb_id":"9d39d89c-c940-4eea-9e6f-e656b6155947","wattage":600,"form_factor":"ATX","efficiency_rating":"80+ Silver","modular":"Semi-Modular","color":[],"lighting":[],"length":160,"fanless":false,"connectors":{"atx_24_pin":1,"eps_8_pin":1,"pcie_12vhpwr":0,"pcie_6_plus_2_pin":4,"sata":6,"molex_4_pin":3,"floppy_4_pin":1},"identifiers":{"version":1}},"sources":[{"source":"BuildCores OpenDB","source_path":"PSU/9d39d89c-c940-4eea-9e6f-e656b6155947.json","url":null,"imported_at":"2026-10-19T14:46:25Z"}],"confidence":55,"first_seen":"2026-10-19T14:46:25Z","last_verified":"2026-10-19T14:46:25Z"},{"id":"pcd_4c027fe794493912bee5","category":"psu","name":"Cooler Master Elite 700W 80+","normalized_name":"cooler master elite 700w 80+","manufacturer":"Cooler Master","brand":"Cooler Master","series":"Elite","model":"","variant":"700W 80+","aliases":["Elite","Cooler Master","Cooler Master Elite"],"identifiers":{},"specs":{"opendb_id":"5d5fed12-bd7e-4aa0-8dab-2eb2fe70bad8","wattage":700,"form_factor":"ATX","efficiency_rating":"80+","modular":"Non-Modular","color":["BLACK"],"lighting":[],"length":140,"fanless":false,"connectors":{"atx_24_pin":1,"eps_8_pin":0,"pcie_12vhpwr":0,"pcie_6_plus_2_pin":0,"sata":5,"molex_4_pin":0,"floppy_4_pin":0},"identifiers":{"version":1}},"sources":[{"source":"BuildCores OpenDB","source_path":"PSU/5d5fed12-bd7e-4aa0-8dab-2eb2fe70bad8.json","url":null,"imported_at":"2026-10-19T14:46:25Z"}],"confidence":55,"first_seen":"2026-10-19T14:46:25Z","last_verified":"2026-10-19T14:46:25Z"},{"id":"pcd_a79cfbfda771e053f03c","category":"psu","name":"Corsair RM550x (2021)","normalized_name":"corsair rm550x 2021","manufacturer":"Corsair","brand":"Corsair","series":"RM550x","model":"","variant":"(2021)","aliases":["RM550x","Corsair","Corsair RM550x"],"identifiers":{},"specs":{"opendb_id":"cf7a5ae9-0944-48a5-b183-f9e24713ebd7","wattage":550,"form_factor":"ATX","efficiency_rating":"80+ Gold","modular":"Full","color":[],"lighting":[],"length":160,"fanless":false,"connectors":{"atx_24_pin":1,"eps_8_pin":1,"pcie_12vhpwr":0,"pcie_6_plus_2_pin":2,"sata":7,"molex_4_pin":4,"floppy_4_pin":0},"identifiers":{"version":1}},"sources":[{"source":"BuildCores OpenDB","source_path":"PSU/cf7a5ae9-0944-48a5-b183-f9e24713ebd7.json","url":null,"imported_at":"2026-10-19T14:46:25Z"}],"confidence":55,"first_seen":"2026-10-19T14:46:25Z","last_verified":"2026-10-19T14:46:25Z"},{"id":"pcd_afae22f93ab7f14c60ce","category":"psu","name":"FSP Group Hydro 850W Titanium","normalized_name":"fsp group hydro 850w titanium","manufacturer":"FSP Group","brand":"FSP Group","series":"Hydro","model":"","variant":"850W Titanium","aliases":["Hydro","FSP Group","FSP Group Hydro"],"identifiers":{},"specs":{"opendb_id":"30d585c6-41dc-4e29-9c12-3cf938e59d94","wattage":850,"form_factor":"ATX","efficiency_rating":"80+ Titanium","modular":"Full","color":["BLACK"],"lighting":[],"length":150,"fanless":false,"connectors":{"atx_24_pin":1,"eps_8_pin":2,"pcie_12vhpwr":1,"pcie_6_plus_2_pin":5,"sata":12,"molex_4_pin":4,"floppy_4_pin":0},"identifiers":{"version":1}},"sources":[{"source":"BuildCores OpenDB","source_path":"PSU/30d585c6-41dc-4e29-9c12-3cf938e59d94.json","url":null,"imported_at":"2026-10-19T14:46:25Z"}],"confidence":55,"first_seen":"2026-10-19T14:46:25Z","last_verified":"2026-10-19T14:46:25Z"}]