[{"id":"pcd_f7b6bd8ed7c3900989e0","category":"atx-full-tower","name":"BitFenix Colossus Venom Edition","normalized_name":"bitfenix colossus venom edition","manufacturer":"","brand":"","series":"","model":"","variant":"Black","aliases":[],"identifiers":{},"specs":{"color":"Black","psu":null,"side_panel":null,"external_volume":79,"internal_35_bays":7},"sources":[{"source":"docyx/pc-part-dataset","source_path":"json/case.json","url":null,"imported_at":"2026-10-19T14:46:25Z"},{"source":"docyx/pc-part-dataset","source_path":"jsonl/case.jsonl","url":null,"imported_at":"2026-10-19T14:46:25Z"}],"confidence":63,"first_seen":"2026-10-19T14:46:25Z","last_verified":"2026-10-19T14:46:25Z"},{"id":"pcd_0b17de65e1106b04183b","category":"atx-full-tower","name":"In Win AIRFORCE","normalized_name":"in win airforce","manufacturer":"","brand":"","series":"","model":"","variant":"White / Multicolor","aliases":[],"identifiers":{},"specs":{"color":"White / Multicolor","psu":null,"side_panel":"Tempered Glass","external_volume":76.6,"internal_35_bays":2},"sources":[{"source":"docyx/pc-part-dataset","source_path":"json/case.json","url":null,"imported_at":"2026-10-19T14:46:25Z"},{"source":"docyx/pc-part-dataset","source_path":"jsonl/case.jsonl","url":null,"imported_at":"2026-10-19T14:46:25Z"}],"confidence":71,"first_seen":"2026-10-19T14:46:25Z","last_verified":"2026-10-19T14:46:25Z"},{"id":"pcd_365d35c63c479add5d92","category":"atx-full-tower","name":"Thermaltake Spedo Advance Package","normalized_name":"thermaltake spedo advance package","manufacturer":"","brand":"","series":"","model":"","variant":"Black / Silver","aliases":[],"identifiers":{},"specs":{"color":"Black / Silver","psu":null,"side_panel":"Acrylic","external_volume":75.4,"internal_35_bays":6},"sources":[{"source":"docyx/pc-part-dataset","source_path":"json/case.json","url":null,"imported_at":"2026-10-19T14:46:25Z"},{"source":"docyx/pc-part-dataset","source_path":"jsonl/case.jsonl","url":null,"imported_at":"2026-10-19T14:46:25Z"}],"confidence":63,"first_seen":"2026-10-19T14:46:25Z","last_verified":"2026-10-19T14:46:25Z"}]